{
 "id": "ability-dexterity",
 "name": "Dexterity",
 "system": "openfrp74",
 "prime_requisite_for": null,
 "exchange": [],
 "modifiers": [
  {
   "condition": "Dexterity above 12",
   "effect": "Fire any missile at +1",
   "note": null
  },
  {
   "condition": "Dexterity under 9",
   "effect": "Fire any missile at -1",
   "note": null
  }
 ],
 "description": "Speed and accuracy: it orders who strikes first and steers every missile.",
 "related": [],
 "interpretation_records": [],
 "source": {
  "work": "OpenFRP74",
  "booklet": "v1",
  "page": "p10",
  "blocks": [
   2,
   6
  ],
  "content_sha256": [
   "d46720ffc3ed77aeba139dac24534adbb85f424b3bbb38b6743a5232fe1904b3",
   "695ec8cd2de9b103d7d07f833526c065a8248add2682a8945199c577aae18083"
  ],
  "also": [
   {
    "booklet": "v1",
    "page": "p11",
    "blocks": [
     6,
     7,
     8
    ],
    "content_sha256": [
     "6a1eaa4d40a9d30a4afa28f79ca551020eca0317da3a51fc5a5bc3f0168c889b",
     "240e65eeea47d4aef624a9dda9f07c81a07a81e4a41770ac24277567bad9c949",
     "cd51ee719f30234ac6f9c85b9a5e73a079575a8bcbedd64e385185c19f29de64"
    ],
    "note": "Bonuses and Penalties table"
   }
  ]
 },
 "extraction": {
  "date": "2026-07-17",
  "model": "claude-opus-4-8",
  "notes": null
 }
}
